473108951,SOUL SISTERS LEADERSHIP,"THE PURPOSE OF S.O.U.L. SISTERS IS TO CREATE, ENCOURAGE AND PROMOTE, LEADERSHIP DEVELOPMENT AND SOCIAL ENTREPRNEURSHIP PROGRAMS FOR TRADITIONALLY INVISIBLE AND DISCARDED FEMALE LEADERS THROUGHOUT HIGH SCHOOL AND INTO COLLEGE.",,,,,,,100.0,197.29315737149537,220.42462953718282,,867.7248270889069,
473110208,Independence County Shooting Sports Foundation,Supports other organizations.,,,,,100.0,0.0,118.78144892391633,,,,,
473118388,ANCHORS OF HOPE MINISTRIES INC,TO SUPPLY NEEDS TO FAMILIES WITH CHILDREN WHO ARE SICK AND HOSPITALIZED,,,,,,100.0,106.28320628320628,183.27558327558327,58.004158004158,,62.78586278586279,92.05359205359204
473119340,SACHEM NORTH BOYS LACROSSE BOOSTER CLUB,lacrosse club for children. to enhance lacrosse for children.,,,,,,,100.0,88.98751710275164,68.98025371193054,50.49239033124441,59.183121906724544,61.491359943244206
473126436,Code RGV Inc,"Code RGV creates tech entrepreneurs and skilled professionals for local jobs by educating, promoting, and certifying professionals. The nonprofit strives to promote community participation and collaboration to invigorate creativity, innovation, and the local economy.",,,,,100.0,222.6748229233741,289.1371538956858,,,,,
473128387,OUR SUNFLOWER FRIENDS OF ELLIS COUNTY,To raise funds for children (or others as the need arises) in the Ellis County community who are faced with life threatening disease are life altering injury due to accident,,,,,100.0,172.4262018554962,79.51082372786055,115.05482147877424,,,,
473156339,JOG YOUR MEMORY 5K INC,TO RAISE MONEY TO FUND RESEARCH TO CURE ALZHEIMER'S DISEASE,,,,,100.0,130.85342778128185,147.3465625151618,208.37222842171656,204.57619717626508,203.71355101644752,237.9409053418078,242.50060647227207
473158402,SCHOLARS INC,"To assist people as they construct their lives to become more economically and socially advanced through activities, events, and programs that combine training information and fun on how to live a healthy and productive lifestyle.",,,,,,100.0,299.0416939532853,370.4758786291203,512.6064178127046,1361.1154769700938,1182.9294913774286,1062.6522593320235
473168206,ORANGE COUNTY FIRE HOCKEY INC,"ORGANIZED EXCLUSIVELY FOR RAISING FUNDS AND DISTRIBUTING TO ORGANIZATIONS THAT QUALIFY AS EXEMPT ORGANIZATIONS UNDER 501(C)(3) OF THE INTERNAL REVENUE CODE,OR THE CORRESPONDING SECTION OF ANY FUTURE FEDERAL TAX CODE.",,,,,,100.0,,,,,,
473168362,MACEDONIA COMMUNITY DEVELOPMENT,"IMPROVE CONDITIONS OF AN UNDERSERVED COMMUNITY BY PROVIDING PROGRAMS AND SERVICES IN MENTAL HEALTH, PHYSICAL HEALTH AND FINANCIAL HEALTH.",,,,,100.0,51.27515964756285,438.0688707460997,464.88764044943827,288.9883598738986,,287.2120281303047,339.1419448710694
473191223,CREATING BRIGHT FUTURES,PROVIDE A STIMULATING LEARNING EXPERIENCE TO UNDER PRIVILEGE YOUTH IN A CLEAN SAFE AND HEALTHY ENVIRONMENT WHILE PROMOTING MUTUAL RESPECT AND TRUST BETWEEN PARENTS AND TEACHERS,,,,,,100.0,,,,,,
473191800,PEER Wellness Center Inc,To provide PEER recovery support,,,,,100.0,287.18374665453734,,,,,,
473201619,MUSTANG OUTREACH PROGRAM INC,"THE MUSTANG OUTREACH PROGRAM AIMS TO TOUCH THE HEARTS AND MINDS OF OUR YOUTH IN A TIME WHEN MANY SCHOOLS ARE FINDING THEIR CULTURAL ARTS PROGRAM BUDGETS SLASHED. WE HAVE BEEN WORKING TOWARDS STRENGTHENING THIS PROGRAM WHERE TALENTED LOCAL, REGIONAL AND NATIONAL MUSICIANS WILL WORK WITH AND PERFORM BEFORE OUR LOCAL STUDENTS TO BROADEN THEIR CULTURAL HORIZONS.WITH THE HELP OF LOCAL BUSINESSES AND INDUSTRY PROFESSIONALS, THIS PROGRAM HAS ALREADY BEGUN REACHING HEIGHTS OF WHICH BOTH CURRITUCK AND DARE COUNTY STUDENTS HAVE ONLY DREAMED.",,,,,,,100.0,,,,,
473210253,FETCHING TAILS FOUNDATION,"COMMITTED TO SAVING DOGS REGARDLESS OF BREED, AGE AND PHYSICAL ABILITY",,,,,100.0,206.51069461640267,320.510822695641,411.55808393459415,438.0288605217094,495.68479699440724,433.43081586474835,468.0154122016821
473210620,EAST FISHKILL BABE RUTH LEAGUE INC,"The Babe Ruth Baseball/Softball program, using regulation competitive baseball and softball rules, teaches skills, mental and physical development, a respect for the rules of the game, and basic ideals of sportsmanship and fair play. In all aspects, Babe Ruth League, Inc. is committed to providing our participants the very best educational, sports experience possible. It is our fundamental belief that every child with a desire to play baseball or softball be afforded that opportunity.",,,,,,100.0,122.90980335244177,120.10304041796675,,136.1715405268123,121.84892242943181,157.02053551991872
473219459,NWHL FOUNDATION INC,promotes the growth of women's hockey providing long-range support for the NWHL.,,,,,,,100.0,1.573736347999088,,,,
473225170,TOM JENKINS BBQ HOPE DRIVEN,THE ORGANIZATION'S MISSION IS TO PROVIDE FINANCIAL ASSISTANCE TO THE NEEDY AND OTHERNON-PROFIT ORGANIZATIONS.,,,,,100.0,,218.1567546278062,238.99172902717604,214.5726664040961,133.0445057109098,140.9216226860969,133.0445057109098
473225789,ANIMAL JUSTICE LEAGUE,"To reduce the homeless pet population through rescue, education, and outreach.",,,,,,100.0,243.5808136773785,242.51279615851408,310.07123634636696,529.5762756582766,420.3208273969711,278.48029127750516
473227605,Ecumenical Coalition for Women and Families,To build a community of people,,,,,100.0,8.650309508074198,95.20011626015979,0.10726383790012008,91.76213724927078,50.30293383897276,307.89946264277336,73.39441605220635
473239803,YOUTH PATROL,Our organization is committed to providing community service that gives availability and aid to off-track youths and homeless and disabled indiviuals.,,,,,100.0,,,,,,,
473242187,Foundation 4 Arts Inc,"Our mission is to reach young children and teach them about arts, eduction, music, dance and entreprenualship.",,,,,,100.0,35160.171568627455,48907.8431372549,65190.44117647059,51734.313725490196,57160.17156862745,52212.132352941175
473249071,AMERICAN CENTER FOR AMAZIGH STUDIES,Increased awareness and understanding of indigenous persons by facilitating information sharing and education.,,,,,,,100.0,,,,,
473257947,FUN COAST WORKSITE WELLNESS COUNCIL,TO PROVIDE RESOURCES AND EDUCATION TO IMPROVE THE HEALTH AND WELLNESS OF EMPLOYEES IN VOLUSIA AND FLAGLER COUNTIES.,,,,,100.0,187.02237043212452,,,,,,
473264705,NA LEO KAKOO O KA PUNANA LEO O HANA,TO SUPPORT AND PROMOTE,,,,,100.0,100.0,135.65891472868216,215.35314384151593,37.316968130921616,12.31696813092162,13.156761412575365,
473266482,ACTION MOBILITY FOUNDATION,THE MISSION OF THE ACTION MOBILITY FOUNDATION IS TO PARTIALLY FUND THE ACTION TRACKCHAIR AND ACTION TRACKSTANDER FOR PEOPLE WITH MOBILITY AND FINANCIAL NEEDS.,,,,,,100.0,49.42127002859607,28.031575342183125,50.017537271860725,75.64258627306151,8.357232164594517,14.052925423267215
473269569,SANTA BARBARA WATER POLO CLUB INC,To offer a competitive and experience-rich environment for young water polo players.,,,,,100.0,225.7163455895914,219.27915541918864,207.27718815843156,253.7805498270264,108.626326643529,153.69001112172984,
473274539,STANISLAUS COUNTY OFFICE OF EDUCATION,"TO PROMOTE THE INTERESTS OF THE STANISLAUS COE AND THE STUDENTS AND CLIENTS THEREOF. MODE AND MANNER TO INCLUDE THE STANISLAUS COE EDUCATIONAL PROGRAMS, THE STANISLAUS COE DIRECTLY OPERATED UNINCORPORATED CHARTER SCHOOLS, AND ANY JPA THE STANISLAUS COE IS AFFILIATED WITH.",,,,,100.0,80.7125890736342,1011.8764845605701,1226.1757719714965,107.50593824228028,36.57957244655582,8825.368171021379,3961.4726840855105
473275522,KREWE OF POSEIDON,"TO CONDUCT A MARDI GRAS PARADE IN SLIDELL, LOUISIANA AND TO SUPPORT OTHER PUBLIC CHARITIES.",,,,,100.0,112.17846963385223,148.71300153475116,144.7353650515238,160.29554922166193,,110.49375137031352,198.09690857268143
473280791,SIMPLE LIFE INC,TRAINING AND EDUCATION FOR DEVELOPMENTALLY DISADVANTAGED INDIVIDUALS,,,,,100.0,1204.6735328410416,3323.931208705791,4665.196268946755,6891.828604741547,7748.581422464049,,8069.121647881851
473285813,A BETTER WORLD FOUNDATION UNLIMITED,"A Better World is a media organization which is committed to the creative fulfillment of human potential, seeking to cultivate a holistic, creative and compassionate perspective through its media, workshops, and trainings in holistic thinking, and quantum awareness.",,,,,100.0,100.0,37.04916261480281,59.359265262020536,46.48406266882766,277.5343057806591,196.51647757968666,83.7979470556456
473286543,HANDS TOGETHER FAMILY HEALTH CENTER INC,To improve health of underprivileged,,,,,,100.0,335.7375,145.67125000000001,151.1125,6.25,0.0,0.0
473287245,Learn Build Fly Inc,Learn Build Fly is an organization promoting aviation and STEM skills,,,,,,,100.0,12.012020206499233,23.028723654633954,14.532033986758671,124.40402083411502,53.19384800100965
473287331,Under His Umbrella,The mission of the Organization is to assist leaders in the local church and their communities as they strive to transform the lives of impoverished children and families through the hope of the Gospel of Jesus Christ.,,,,,100.0,212.27703323511707,327.6692646453125,440.57203054209043,487.61286949909703,456.03317175173464,442.17279726261756,501.5635395874916
473295637,BRIAN DUENSING FOUNDATION,BRIAN DUENSING FOUNDATION PROVIDES HOPE AND SUPPORT TO FAMILIES BATTLING CANCER OR SERIOUS ILLNESS.,,,,,100.0,15.978227668087108,53.85096868850242,18.50247617712303,41.98534824213957,,,
473316489,THE GEORGE JOSEPH AND SUSIE EZZELL ATTA MEMORIAL LIBRARY INC,"OWN, MAINTAIN AND OPERATE A PUBLIC MEMORIAL LIBRARY",,,,,100.0,48.77327914027214,138.04619419074498,73.01261702036524,480.2349212090637,335.28672666612727,158.13871583386083,113.6374236720241
473319632,IDAHO CRUSH VOLLEYBALL CLUB INC,"""IDAHO CRUSH"" IS DEDICATED TO TEACHING AND INSTRUCTING YOUNG PEOPLE HOW TO BE SUCCESSFUL PLAYING THE SPORT OF VOLLEYBALL & COMPETING AT THE HIGHEST LEVELS OF CLUB VOLLEYBALL.",,,,,,100.0,156.53935676786895,,169.3568528177509,167.45654870113322,166.8113627482628,221.28179207937615
473332326,Roger Hoagland Christian Missions Inc,Proclaim the Gospel of Jesus Christ,,,,,100.0,,375.8803968600087,391.351395551679,385.93818142171824,735.9354557348452,440.4437418229394,369.1179677278674
473333029,HUNTERSALIKE INC,PROVIDING HUNTING OPPORTUNITIES FOR PEOPLE,,,,,100.0,100.0,,100.0,,,,
473341292,OUR HOMETOWN CHARITABLE FOUNDA,"TO GIVE EQUAL AND UNBIASED OPPORTUNITY TO ALL OF OUR CITIZENS, REGARDLESS OF RACE, CULTURE, AGE, GENDER OR ECONOMIC STATUS AND TO PRESERVE A RURAL COMMUNITY",,,,,100.0,78.01978437256864,55.89396465488497,45.90352339668778,,42.42102923196621,32.43570078915194,22.337445815271757
473341435,PRO BUFF ELITE SPORTS INC,TO PROVIDE OPPORTUNTIES FOR UNDER PRIVILAGED KIDS TO PLAY YOUTH SPORTS,,,,,100.0,218.05194805194805,257.6623376623377,,,,,
473345596,BOYNTON UNITED FC SOCCER ACADEMY INC,TO BUILD DISCIPLINE AND HEALTHY BODIES AND MIND FOR YOUNG CHILDREN,,,,,,100.0,522.6653102746693,,1268.7690742624618,1671.3123092573753,1783.1129196337743,
473360048,THE HEALTHY SCHOOL FOOD COLLABORATIVE,THE HEALTHY SCHOOL FOOD COLLABORATIVE WORKS WITH THE SUMMER FOOD SERVICE PROGRAM (SFSP) AND THE CHILD AND ADULT CARE FOOD PROGRAM (CACFP) TO PROVIDE FREE AFTER SCHOOL AND SUMMER MEALS TO LOW INCOME CHILDREN 18 AND UNDER WHEN SCHOOL IS NOT SESSION.,,,,,,,100.0,64.21731910931602,81.89083700780758,1186.4583884564063,2986.656903029636,
473361628,VETERANS NON PROFIT,THE VETERANS NON-PROFIT'S MISSION,,,,,100.0,188.23650779615056,309.69139623308865,,200.3419105727002,303.05951012467943,314.2069737966811,
473378631,IBD HORIZONS INC,"IBD HORIZONS IS FOCUSED ON PROVIDING SCIENTIFIC EDUCATION RELATED TO THE DIAGNOSIS, MANAGEMENT, AND ADVANCEMENT OF KNOWLEDGE REGARDING IRRITABLE BOWEL DISEASE. WE PROVIDE ACCREDITED EDUCATIONAL SYMPOSIA AND DISSEMINATE INFORMATION TO MEDICAL PROVIDERS AND RESEARCHERS.",,,,,,,100.0,151.748560597933,111.149912384222,131.0136609090584,133.4173729571219,219.36576905196154
473382204,KELLYS ANGELS FOUNDATION INC,"TO PROVIDE SUPPORT FOR CHILDREN OF HOMICIDE VICTIMS AND VICTIMS OF VIOLENT CRIMES BY PROVIDING SUPPORT IN THE FORM OF SPORTING ACTIVITIES, PEER MENTORING, TUTORING AND THERAPY.",,,,,100.0,174.36789607979588,232.45186731616795,387.1568854867394,223.188741977886,379.52524549601793,,505.2346709966752
473390644,MOSDOS NESIVAS SHALOM INC,"THE ORGANIZATION RAISES FUNDS TO SUPPORT EDUCATIONAL INSTITUTIONS WHICH EDUCATE CHILDREN AND ADULTS FROM KINDERGARTEN THROUGH UNDERGRADUATE STUDIES IN BEITAR, ISRAEL. ALSO PROVIDES SUPPORT SERVICES, HOUSING ASSISTANCE, FREE LOAN FUNDS TO THE NEEDY FAMILIES IN BEITAR, ISRAEL.",,,,,100.0,190.01838885352572,176.81589928566376,,392.89058632152205,369.2060966122074,424.71709456114297,450.74191951340265
473392405,Torah Tavlin Harbotzas Torah Network,"To promote and enhance Jewish scholarship and values through the desemination of weekly newsletters, online information, and books.",,,,,100.0,,,,,1631.787986526946,2656.6008607784433,
473398323,OCEANS MINISTRIES,OCEANS MINISTRIES SEEKS TO COME ALONGSIDE INDIVIDUALS TO HELP THEM FULFILL THEIR GOD-GIVEN POTENTIAL BY USING THE FOUNDER'S BOOK/DVD AND WEEKLY BLOG TO ENABLE THEM TO COME TO THE REALIZATION THAT GOD THE FATHER LOVES THEM. THIS MAY INCLUDE COUNSELING TO HELP FORGIVE THEMSELVES AND/OR OTHERS. OCEANS MINISTRIES ALSO PROVIDES MISSION TRIPS TO LESOTHO AFRICA.,,,,,100.0,205.54779106952506,276.9169726400568,602.5488570413361,526.6042875755064,547.670259386474,640.2807059102215,486.3531919933673
473400856,Sioux City Westside Connection,"Designed to bring pride into our feeder schools and community. We work with parents, coaches, teachers & administrators to provide kids with opportunities to be good students, athletes and community members.",,,,,100.0,191.79526221779744,195.0367485578753,176.00948727709292,,,,233.54220959854763
473403988,UOSSM USA,"UOSSM USA'S MISSION IS TO SUPPORT THE HEALTH-RELATED NEEDS AND WELL-BEING OF PEOPLE AND COMMUNITIES AFFECTED BY CRISES, REGARDLESS OF POLITICAL AFFILIATION, RELIGION, NATIONALITY, ETHNICITY OR GENDER. UOSSM USA IS DEDICATED TO BUILDING SUSTAINABLE HEALTH-RELATED SERVICES AND REDUCING HUMAN SUFFERING.",,,,,100.0,903.0056179775281,1450.457240948814,1157.4422596754057,621.5106117353308,1233.4691011235955,1092.5,1687.92759051186
473414055,LINCOLN SOCCER ASSOCIATION,"LINCOLN SOCCER ASSOCIATION (MAGELLAN SOCCER CLUB) IS A YOUTH SOCCER CLUB IN LINCOLN, NE. WE FOCUS ON THE INDIVIDUAL DEVELOPMENT OF PLAYERS WITH AN EXCLUSIVE, FOCUSED, AND FUN CURRICULUM. SERVING AGES 4 THROUGH 19, MAGELLAN SOCCER FOCUSES ON THE INDIVIDUAL DEVELOPMENT OF WELL-ROUNDED SOCCER PLAYERS WITH A PROVEN CURRICULUM BASED ON NATIONAL AND INTERNATIONAL TRAINING METHODS. THE CLUB PROVIDES MULTIPLE LEVELS OF SOCCER EDUCATION IN A FUN AND FAMILY-ORIENTED ENVIRONMENT: FROM RECREATIONAL/LOCAL OPTIONS THROUGH ADVANCED/REGIONAL/NATIONAL OPPORTUNITIES.",,,,,,100.0,110.90253617707862,104.61957343820904,135.9095951192457,124.32738365350677,175.79917309534613,81.4012000201684
473415820,FC BELLEVUE,PROVIDE YOUTH SOCCER TRAINING,,,,,100.0,,142.71558559110366,143.4744142047272,162.04087466056882,187.76074099784262,165.3041779810395,188.46104112646918
473416413,OUR PLACE FOUNDATION INC,"TO ASSIST THOSE IN NEED OF HELP RECOVERING FROM THE DISEASE OF ADDICTION, PROVIDING INDIVIDUALIZED CARE TO CLIENTS.",,,,,100.0,6.053268765133172,3.026634382566586,,,,,
473424205,FOSTERING FOSTER ANIMAL RESCUE,"FOSTERING FOSTER ANIMAL RESCUE IS A VOLUNTEER BASED NONPROFIT. WE ARE DEDICATED TO RESCUING ANIMALS, PRIMARILY DOGS, THAT ARE IN SOUTHERN KILL SHELTERS AND THAT ARE IN DESPERATE NEED OF HELP. WE KNOW THAT SPAY AND NEUTER IS ONE WAY TO REDUCE THE NUMBER OF ANIMALS ON DEATH ROW IN SHELTERS. WE PRIMARILY COLLABORATE WITH NORTHERN RESCUES, SHELTERS AND ANIMAL LEAGUES TO SAVE AS MANY LIVES AS POSSIBLE.",,,,,100.0,222.09780049100658,291.33724134475676,1058.1316699233428,1237.096046896137,1577.9272508642719,1671.9499974948644,1666.0679392755148
473429413,DOUGLAS COUNTY CANINE RESCUE,PLACEMENT OF UNWANTED ANIMALS,,,,,100.0,512.0652646104311,238.74990417294865,657.1256995374748,579.3792962461349,818.5866148774691,894.6042981626761,738.6515217335752
473430023,LU'S LABS LABRADOR RETRIEVER RESCUE INC,FOSTER-BASED RESCUE DEDICATED TO THE,,,,,100.0,225.20548336835486,425.34699887073486,540.5706362479809,467.96174793087187,,,
473431539,LIGHTUP,"Light Up strives to create a world made better through selflessness, fostering a culture of volunteerism that empowers people to serve and uplift communities.",,,,,100.0,347.6039869656891,656.7823142291228,347.57842949332314,105.651396076928,42.1730240879177,22.372372372372375,
473441374,SACRAMENTO COMEDY FOUNDATION,"Non-profit corporation that operates the Sacramento Comedy Spot, Improv Marathon, Stand-Up Competition, Comedy Festival, and Northern Californias largest comedy school.Our mission is to make Sacramento laugh. Every day. Our goals are to attract people to Sacramento and to bring happiness to everyone, from kids to adults, through comedy education, shows, and special events.",,,,,,100.0,126.19088608915669,154.3923624696768,182.45715627200875,118.34468007407987,262.13214388188953,226.39434488874977
473442726,YOU ARE ABLE,The specific purpose of this corporation is to share the love of Jesus Christ to people in the Third World countries by providing means to help them to be self sufficient.,,,,,100.0,224.40391943385953,107.61023407729995,70.86281981491562,339.1984213391399,125.2994011976048,139.90201415351115,92.54218835057159
473459963,LIVING WELL ON WILKENS INC,"TO OFFER WOMEN IN NEED THE HOPE OF CHRIST, SUPPORT THEM IN TRANSFORMING THEIR LIVES AND HELP THEM GET OFF OF WILKENS AVENUE AND INTO PROFESSIONAL DETOX CENTER, SAFE HOUSING AND THRIVING LIVES.",,,,,100.0,62.91373222815928,25.9596321960614,9.47265071842607,11.34188018050337,56.80947076260786,0.009440552838774239,
473461777,Womens Center for Creative Work,"The Women's Center for Creative Work is a volunteer-run not-for-profit organization. Your donations help us pay rent at our work center, support our artists in residence, and continue to provide free and low cost programming to our community of creative professional women in Los Angeles.",,,,,,100.0,262.47045676411653,294.69185120485025,,441.4896213327853,,433.7544314853825
473466416,FRANKLIN RAILROAD & COMMUNITY MUSEUM,"MAINTAIN AND OPERATE A MUSEUM FOR TOWN OF FRANKLIN, DELAWARE COUNTY,",,,,,100.0,20.08890484389577,2.8625941511603945,4.6400262371224255,7.348388655103719,3.6838338108755533,5.595997066051512,6.501000511889804
473470087,JUSTICE RISING INTERNATIONAL,"THROUGH PARTNERSHIPS WITH LOCAL AGENCIES, JUSTICE RISING INTERNATIONAL SERVES TO BUILD SCHOOLS IN UNDER-SERVED, WAR-AFFECTED REGIONS; THEREBY PROVIDING ACCESS TO SCHOOLS AND QUALITY EDUCATION.",,,,,100.0,135.90928993443535,393.33208231688246,415.0775914521458,445.65584537436666,512.8610177587472,651.9842826842264,646.6248144799467
473473611,BRAUSA UNITED FUTEBOL CLUB INC,Encourage physical exercise and good citizenship,,,,,100.0,229.1355876916386,418.17766663042295,,,500.358812656301,535.4028487550288,562.5095139719474
473479109,Khalsa Gurmat Center,To work on education and empowerment programs for the Sikh community,,,,100.0,397.83978397839786,3421.6741674167415,1248.1308130813081,2083.5613561356136,1268.5598559855987,1018.8148814881489,1415.7665766576658,1850.6810681068107
473491312,MOUNTAIN VIEW FIREFIGHTERS RANDOM ACTS,TO PERFORM RANDOM ACTS OF GOOD IN THE MOUNTAIN VIEW AREA AND SOMETIMES IN THE STATE,,,,,100.0,151.91566014641694,228.94159488233527,232.26946259901618,141.4724833144731,,95.14791806193853,3.5795940047573955
473491312,MOUNTAIN VIEW FIREFIGHTERS RANDOM A,"MOUNTAIN VIEW FIREFIGHTERS RANDOM ACTS IS A 501(C)3 CHARITY CREATED BY DEDICATED FIREFIGHTERS FROM THE MOUNTAIN VIEW FIRE DEPARTMENT WHO TRULY BELIEVE THAT INDIVIDUALS CAN MAKE A DIFFERENCE IN OUR COMMUNITY. OUR PURPOSE IS TO PERFORM RANDOM ACTS OF GOOD IN THE MOUNTAIN VIEW AREA AND SOMETIMES IN THE STATE. OFTEN, AS FIREFIGHTERS RESPOND TO CALLS FOR HELP, WE OBSERVE SITUATIONS WHERE PEOPLE NEED A HELPING HAND OR SOMETHING THAT WILL IMPROVE THEIR QUALITY OF LIFE. WE LOOK FOR OPPORTUNITIES TO COMPASSIONATELY MEET THE NEEDS OF PEOPLE AND MAKE A DIFFERENCE THROUGH OUR RANDOM ACTS OF KINDNESS",,,,,100.0,151.91566014641694,228.94159488233527,232.26946259901618,141.4724833144731,,95.14791806193853,3.5795940047573955
473492306,NEIGHBORHOODS RUNNING NEIGHBORHOODS,TO HELP NEIGHBORHOODS WITH SOLUTIONS TO SOLVING THEIR PROBLEMS FOR THEMSELVES.,,,,,,100.0,291.50943396226415,0.6339970037127907,,0.0,,
473495821,WITHERS SWASH PARK MINISTRY,"TO SHARE THE CHRISTIAN FAITH THROUGH PAIRING INDIVIDUALS, CHURCHES AND",,,,,100.0,119.28989751098096,183.78477306002927,206.33235724743776,198.8103953147877,268.53953147877013,412.2620790629576,269.015373352855
473497796,CHARLOTTE HANS FOUNDATION INC,"TO PROVIDE FINANCIAL ASSISTANCE TO AN EMPLOYEE, SPOUSE OR CHILD OF THE PALM BEACH COUNTY",,,,,100.0,201.10593101514303,390.9247055524397,392.02888390353337,318.5589596186203,372.96515703869886,187.93641334828942,289.8380538418396
473498605,ARIZONA ANIMAL RESCUE MISSION,To support Maricopa County Animal Care and Control by providing the best possible outcomes for all shelter animals.,,,,,,,100.0,86.65725990761692,50.98359306019663,25.426072242773877,,
473499843,STEVEN VANOVER MEMORIAL RESEARCH,THE FUND'S MISSION IS TO RAISE MONEY TO DONATE TO CANCER RESEARCH AND A SCHOLARSHIP FUND TO THE UNIVERSITY OF LOUISVILLE.,,,,,,100.0,145.44195154469512,131.18555090306856,216.12399225048432,227.45557569318584,175.00781201174925,180.85536320646628
473511005,PUPSTARZ RESCUE INC,DEDICATED TO THE RESCUE AND REHABILITATION OF DOGS WHO ARE AT RISK OF EUTHANASIA DUE TO OVERPOPULATION AND THOSE WHO ARE IN DANGER OF ABUSE OR NEGLECT.,,,,,100.0,300.53488405987207,331.10052030956234,382.6650926209319,407.9562182093772,460.7712824100389,539.1820791978197,653.2100330841093
473515841,Refugee Development Center,Refugee Development Center provides post settlement services to Refugee Communities,,,,,,100.0,332.8985614164515,412.77609738104024,648.0236075248986,1210.5186278126153,1775.5411287347845,2589.7277757285133
473520181,OKC Dodgers Baseball Foundation,"To enhance the community we serve through charitable contributions, grants and programming initiatives aimed at supporting families and children in the areas of education, good health and community service activities.",,,,,100.0,214.03982136211388,965.3609973948642,951.1723111276517,700.9117975437291,76.9352437662821,771.0271678451804,2179.903237811686
473533577,Soaring Above Ionia,"Provide all teens the ability to build self-confidence, integrity and the leadership qualities needed to become proud, responsible and productive adults",,,,,,,100.0,76.70960890243339,162.8642009511936,138.44253590063258,134.0305674839544,170.74387034215266
473548839,Reach Family Services,To assist parents and quardians of children with a mental illness to better,,,,,,100.0,206.42542276667766,158.82291104554596,173.77935539031895,190.5018536558017,200.07954250793674,304.78481473954207
473550317,UNION GROVE BRONCOS SHOOTING CLUB I,"OUR MISSION IS TO INSTILL IN YOUNG PEOPLE REPECT FOR GOOD SPORTSMANSHIP, COMPETITIVENESS, COOPERATION, TEAMWORK, AND HIGH MORAL CHARACTER THROUGH SHOOTING SPORTS COMPETITION.",,,,,100.0,139.05970367070427,,470.28642092892864,,104.72682863133961,,326.83938460593123
473554614,LAUNCH,"LAUNCH COORDINATES ACTIVITIES SUCH AS RELIGIOUS EDUCATION CLASSES, SOCIAL GROUPS, AND PARENTAL SUPPORT FOR CHILDREN WITH DISABILITIES AND THEIR FAMILIES.",,,,,100.0,610.024762361211,1189.9432862049684,2306.4462017733044,2730.202092818915,2560.4601006470166,3806.725776819235,3716.9955001730705
473556575,CROCKETT YOUTH SERVICES INC,PROVIDING NBSP;MEALS NBSP;FOR NBSP;UNDERPRIVILEGED NBSP;YOUTH,,,,,100.0,484.0091901206203,,359.64771204288724,,,,
473559712,GUIDED STEPS,TO RAISE FUNDS FOR NEEDED FAMILIES WHO SUFFER FINANCIAL HARDSHIP DUE TO THE COST AND EFFECTS OF A MEDICAL CONDITION KNOWN AS EOSINOPHILIC ESOPHAGAITIS. TO PROMOTE ITS AWARENESS AND RESEARCH.,,,,,100.0,,,,,,,
473574238,CHINESE BUSINESS ASSOCIATION OF NEW YORK,TO PROVIDE THE COMMUNITY WITH THE LEARNING TOOLS TO ADAPT TO AMERICAN LIFE STYLE.TO ENHANCE THE COMMUNITY AND MEMBERS TO UNDERSTAND LIVING IN AMERICA.,,,,,100.0,17.732506417914244,94.60196222962153,0.4066797143075007,87.87014208372518,28.975929644409426,61.90936125867371,1.690897999644155
473579570,CANCER RESEARCH AND LIFE FOUNDATION,"The organization conducts alternative cancer care and research for the needy, the hopeless and the forgotten stricken with the deadly disease.",,,,,100.0,85.05986867516415,473.2676709154114,343.4121282348397,680.3097721127848,549.6670529161838,106.06952491309384,194.50830436461953
473595671,NWA DOMESTIC VIOLENCE EMERGENCY SER,"NWA DOMESTIC VIOLENCE EMERGENCY SERVICES IS A NONPROFIT 501(C)(3) ORGANIZATION THAT SUPPORTS VICTIMS OF DOMESTIC VIOLENCE. OUR MISSION IS TO FOCUS ON EMPOWERING VICTIMS AND PERPETRATORS THAT ARE READY TO IN THE CYCLE OF ABUSE IN THEIR LIVES, WHILE BUILDING COMMUNITY ENGAGEMENT AND ADVOCATING FOR SOCIAL CHANGE TO STOP THE VIOLENCE. THE PURPLE RIBBON THRIFT STORE AND DONATION CENTER PROVIDES VICTIMS WITH CLOTHING HOUSEHOLD ITEMS AND ESSENTIALS. THE PURPLE RIBBON FOOD PANTRY IS A WAY TO PROVIDE FOOD TO OUR VICTIMS IN NEED. WE ALSO OPEN IT TO THE PUBLIC EVERY MONDAY TO SUPPORT FEEDING THE HUNGRY IN OUR COMMUNITY. ASSISTANCE PROGRAMS INCLUDE SAFETY PLANNING, RISK ASSESSMENT, CRISIS INTERVENTION, EMERGENCY CARE KITS, MENTORSHIP AND JOB ASSISTANCE. A VARIETY OF ADDITIONAL ONGOING SUPPORT AND SELF-CARE ACTIVITIES ARE PROVIDED.",,,,,100.0,162.65125033611184,,,,,,
473596045,GRANNY'S PANTRY INC,"Good nutrition is a building block for proper development that strengthens the immune system, enhances cognitive and physical development and increases concentration in school.",,,,,,,100.0,,,,,
473606121,Thomas H Wernsing Wig Relief Foundation Inc,To provide chemotherapy patients with wigs at low or no cost.,,,,,100.0,118.57142857142857,16.428571428571427,,442.8571428571429,583.3333333333333,231.19047619047618,
