465062453,ATHENA'S SISTERS INCORPORATED,"THE ORGANIZATION IS FOR ALL MILITARY WOMEN TO USE REVOLUTIONARY EXPRESSIONS TO GROW IN DIGNITY AND HONOR. OUR MEMBERS EMPOWER THEMSELVES THROUGH A SISTERHOOD CREATED BY MIND, BODY, AND HEART HEALING. OUR ARTISTIC ADVOCACY IS BUILDING A COMMUNITY OF COURAGE.",,,,,100.0,165.50514002126906,,,,,,
465075844,SEBRING ANGELS,Animal Rescue,,,,,100.0,54.02968533544429,40.30001979022363,53.9038195131605,67.94933702750842,50.33603799722937,112.23906590144468,35.81951316049871
465100956,Wine Psi Phi Phila Beta Chapte,WE ARE A FRATERNAL ORGAINIZATION DEDICATED TO ASSISTING AT-RISK YOUTH WITHIN THE URBAN COMMUNITY,,,,,100.0,,,,,,,
465110309,PITTSBURG YOUTH SOCCER CLUB,PROVIDE PUBLIC BENEFIT YOUTH SOCCER SERVICE TO PITTSBURG AND SURROUNDING COMMUNITIES,,,,,100.0,,107.16118237590631,87.31227500887289,71.46174517061299,35.28165086447295,27.264614916594837,78.08041373016276
465125688,BRECKENRIDGE FILM FESTIVAL,"EDUCATE, INSPIRE, ENTERTAIN THROUGH INDEPENDENT FILM SCREENINGS.",,,,100.0,129.99378198689436,169.5700004783087,204.40809298321136,222.031855359449,240.85904242598173,276.76471995025594,327.01104893098005,437.76342851676475
465129545,Agape Christian Foundation of Liberia,"To raise awareness and needed funding for the construction, staffing and every support of faith based primary and secondary schools in Johnsonville, Liberia.",,,,,100.0,,100.0,,100.0,,,
465140628,ETERNAL HOPE WORSHIP CENTER INC,ORGANIZATION'S MISSION IS TO SPREAD GOD'S WORD.,,,,,100.0,95.6907318079219,90.43046850831261,97.35210880300652,92.47109776917172,99.79834320611387,139.67711997433457,124.67889592905348
465154498,TIWANTIWA INC,TO ENLIGHTEN AND THE GENERAL PUBLIC ABOUT RELIGION TOLERANCE AND ALSO TO PROMOTE THE CULTURE,,,,,,100.0,95.0,97.5,,,,
465165433,DOMESTIC PREPAREDNESS ASSISTANCE CENTER,"To promote, coordinate and provide planning, training, exercise support, and assistance to local, tribal, state, federal, and private organizations and communities to help them prepare for, respond to, recover from, and mitigate against the effects of natural, environmental, man-caused and technological hazards.",,,,,,100.0,,,,,,
465166232,HARICHAND-GURUCHAND INTERNATIONAL MOTUA MISSION INC,"In keeping with the values of Motuaism, to promote social, cultural and religious understanding based upon hindu religious principles and practice.",,,,,,100.0,121.16335630320228,109.61289014997972,125.64450749898661,80.33745439805432,93.50526955816781,111.46128901499796
465173428,Housing & Financial Educators,Provide housing and financial education to those who are losing their homes.,,,,,,100.0,155.22398892337924,,123.54619352821634,,,
465173428,Housing & Financial Educator I,Provide housing and financial education to those who are losing their homes.,,,,,,100.0,155.22398892337924,,123.54619352821634,,,
465174043,STRIDES FOR PEACE INC,"OUR PURPOSE IS TO IDENTIFY AND FINANCIALLY ASSIST LOCAL COMMUNITY PARTNERS WHO HAVE ACHIEVED DEMONSTRABLE SUCCESS IN AN ARRAY OF STRATEGIES AND PROGRAMS NEEDED TO REDUCE VIOLENCE AND IMPROVE LIFE OUTCOMES, INCLUDING MENTORING, SPORTS AND RECREATIONS, ARTS, EDUCATION, JOB AND CAREER PREPARATION, COGNITIVE-BEHAVIORAL THERAPY, AND LEADERSHIP DEVELOPMENT.",,,,,100.0,153.20526033722223,108.79157121066673,187.16129070253652,82.34383005789198,170.48215831659786,116.14732713384647,229.90182509908777
465176644,WESTPORT UNIFORMED FIREFIGHTERS,"TO ENGAGE IN ANY LAWFUL ACT OR ACTIVITY FOR WHICH FOUNDATIONS MAY BE FORMED, TO PROVIDE FINANCIAL ASISTANCE TO INDIVIDUALS AND ORGANIZATIONS UPON THE TERMS AND CONDITIONS WHICH SHALL BE IMPOSED FROM TIME TO TIME BY THE BOARD OF DIRECTORS OF THE FOUNDATION.",,,,,100.0,110.80674631061139,109.13000702740689,131.34785664089952,260.7926914968377,51.79761068165847,135.46029515108924,113.18482080112437
465179791,WINGS TO FLY INC,"WINGS II FLY GOAL IS TO FURTHER GLOBAL ECONOMIC STABILITY AND EQUALITY BY: PROVIDING SMALL BUSINESS EDUCATIONAL PROGRAMS AND JOB TRAINING; ASSISTING IN THE MARKETING AND SALES OF PRODUCTS MADE BY DISADVANTAGED PEOPLES; ENSURING NECESSARY ACCESS TO CAPITOL THROUGH MICRO-FINANCING PROGRAMS AND/OR GRANTS; AND PROVIDING ACCESS TO NECESSITIES SUCH AS MEDICAL CARE, FOOD AND SHELTER.",,,,,,,,,,,,
465186735,APECS FOUNDATION,"EDUCATE THE PUBLIC ON AGRICULTURAL PRESERVATION, OUTDOOR TRADITIONS, ENVIRONMENTAL CONSERVATION AND SUPPORTING MULTIPLE USE LAND MANAGEMENT. ALSO SUPPORT SIMILAR NONPROFIT ORGANIZATIONS TO PROMOTE EDUCATING THE PUBLIC ABOUT OUTDOOR TRADITIONS AND PROTECTING AGRICULTURAL HERITAGE.",,,,,100.0,,693.6622274564213,,,,,
465186735,ONE CONSERVATION NETWORK INC,TO UNIFY DIVERSE CONSERVATION ORGANIZATIONS AND AMPLIFY THEIR COLLECTIVE IMPACT ON LONG-TERM CONSERVATION OF WILDLIFE AND WILD PLACES FOR EVERYONE.,,,,,100.0,,693.6622274564213,,,,,
465198662,American Medical Professionals Foundation,To improve the healthcare of our community by supporting and providing medical education programs and projects for medical professionals and public,,,,,100.0,9.899029895070283,47.30548406256187,53.77153039002178,,,,
465209246,OCEAN SANCTUARIES INC,"To foster greater understanding, wise ecology, species protection and good stewardship of the ocean and related habitats.",,,,,100.0,181.58713692946057,178.78630705394193,323.8070539419087,,,,
465222420,TOO YOUNG TO WED INC,INTERNATIONAL HUMAN RIGHTS ADVOCACY,,,,100.0,191.83337255824898,376.2297011061426,184.17897636814197,387.7119875956973,414.1043567344566,496.4323785527391,,2748.7768748356016
465230668,KENDRICK MCGHEE CHARITABLE,WOMEN AND CHILDREN SERVICES,,,,,100.0,100.0,,,,,,
465230668,KENDRICK MCGHEE CHARITABLE FOUNDATION,Women and Children services,,,,,100.0,100.0,,,,,,
465233279,PEACE IN THE CITY,"TO PROVIDE A BASE FOR LIFE THRU DEMONSTRATIONOF GODS LOVE IN PROVIDING SHELTER ,EDUCATION, COUNSELING AND COMMUNITY",,,,,100.0,144.27549549787787,0.0,,,0.0,247.8424852243128,
465234580,BIG FISH MINISTRIES INC,PROVIDE CHRISTIAN COUNSELING FOR ALCOHOL AND SUBSTANCE ADDICTION.,,,,,,100.0,246.53579093548794,426.91768716071203,690.3162479484913,602.6922105794723,863.1025123090518,911.3325337709884
465268593,PROJECT LIVING HOPE,"TO EMPOWER HAITIANS BY BUILDING THE KING CENTER., OUR VISION FOR A MULTIPURPOSE COMPLEX THAT MEETS MANY DISTINCT NEEDS IN HAITI, INCLUDING PROVIDING EDUCATION, MENTORSHIP, AND SUPPORT THROUGH SPORTS AND JOB SKILLS TRAINING, EQUIPPING FOR DISASTER PREPAREDNESS AND BECOMING A CENTERPIECE FOR THE COMMUNITY.",,,,,,100.0,53.74144574546887,116.3269882907801,88.64144506588559,123.72561145505576,171.2648403998668,221.25702519215218
465269248,SHANTA LINK,"Bridging the educational gap through the creation of more opportunities to increase the numberof youngsters enrolling in higher education by providing mentorships, scholarships, andpromoting cultural diversity through art.",,,,,100.0,276.2552043628687,,,,,,
465272804,RIFT VALLEY MUTUAL ASSISTANCE,PUBLIC CHARITIES,,,,,100.0,110.1010101010101,123.4006734006734,,,,,
465275687,Chicago Police Foundation,"The Chicago Police Foundation is dedicated to helping improve public safety in the City of Chicago by supporting and funding programs to supplement resources, equipment and training available to the Chicago Police Department.",,,,,100.0,97.16550507218237,104.44369502864812,137.95722879664262,69.58904762878029,87.78656638120738,206.04267582316513,220.292476546692
465293131,EPASD ELEMENTARY PTO,"The East Pennsboro Area School District Elementary PTO, in cooperation with parents and teachers, unites home, school, and community to positively impact the educational process of all children.",,,,,,100.0,117.12535204308514,,,,,
465296749,THE MICHAEL COLLINS FOUNDATION,"A FOUNDATION IN HONOR OF OUR SON WITH DONATIONS SUPPORTING SCHOLARSHIPS, CAUSES AND INITIATIVES",,,,,100.0,54.124241578910656,84.33032289559942,20.81386428621243,63.32903270799917,40.81613083199665,,
465306686,FIGHT THE KRAKEN CORPORATION,"FIGHT THE KRAKEN CORPORATION HOPES TO BRING LIGHT TO THE ATROCITY THAT IS THE GREAT PACIFIC GARBAGE PATCH. WE AS A SPECIES HAVE DAMAGED OUR GREATEST GLOBAL RESOURCE---WATER, THROUGH WASTE AND MISUSE. (RAISING AWARENESS) THE ORGANIZATION HOPES TO GENERATE FUNDING FOR THE OCEAN CONSERVANCY TO AID THEIR CURRENT AND FUTURE CLEANUP EFFORTS. IT HOPES TO DEMONSTRATE THAT HUMANS CAN ENJOY OUR NATURAL RESOURCES WITH ZERO NEGATIVE IMPACT. THE ORGANIZATION ALSO WANTS TO SPOTLIGHT EXACTLY WHAT OUR IMPACT ON THE OCEAN LOOKS LIKE. (EDUCATE THE PUBLIC)",,,,,100.0,365.90416028586014,0.5391781521184278,,1.6462480857580397,,,
465310610,CODED BY KIDS,CODED BY KIDS USES PROJECT-BASED EDUCATION AND MENTORSHIP TO EQUIP UNDERSERVED AND UNDERREPRESENTED YOUTH WITH THE SKILLS AND SUPPORT NEEDED TO SUCCEED IN A TECH-DRIVEN SOCIETY.,,,,,,,100.0,210.22479501274455,217.38892959142936,403.93325465800365,374.9101741240058,515.5224378238228
465317877,GREEN COOPERATIVE ON RESOURCE EDUCATION INC,We undertook one project in 2017: Assisting with water treatment in Puerto Rico,,,,,,,100.0,193.52439291183546,,1.1922992780573178,,
465334365,VIRGINIA INTERSCHOLASTIC ASSOCIATION,,,,,,100.0,0.0,1065.381708238851,1699.244142101285,1231.8972033257746,444.9735449735449,366.66666666666663,1639.9848828420256
465340132,CHILDREN AND TEACHERS FOUNDATION OF,SEE BELOW,,,,,100.0,1.9705394595649204,0.3199687835333138,16.581796897863622,16.014827821675933,66.1231099404936,89.84840503365525,91.2687542678763
465350320,Trained and Maintained Service Dogs,To breed/acquire puppies in order to,,,,,,100.0,100.0,33.201111791586186,,9.128939558109954,0.0,0.0
465355657,MUTTS AND MITTENS MANOR RESCUE AND TRANS,RESUCUE OF DOGS AND CATS WITH MEDICAL AND BEHAVIORAL ISSUES FROM LOCAL SHELTERS TO HELP EASE THE FINANCIAL AND STAFFING BURDEN ON LOCAL MUNICIPAL SHELTERS.,,,,,,100.0,180.4542845923823,,230.6098408191621,147.11390340411396,173.51013380856014,124.84670915516357
465357443,CINECARES FOUNDATION,"CINECARES ENRICHES THE QUALITY OF LIFE FOR CHICAGO RESIDENTS, BY MAKING IT A BETTER PLACE FOR FAMILIES TO LIVE, WORK, THRIVE AND RESIDE. WE ARE DEDICATED TO THE SUPPORT OF EDUCATION INITIATIVES, SCHOLARSHIPS, AND INNOVATIVE COMMUNITY BASED PROGRAMS FOCUSED ON ARTS, FILM AND MEDIA.",,,,,100.0,55.02794456794997,0.0,126.2180299599011,247.14217448214248,150.18387317944774,,
465389206,Magic City Woodworks,"To promote and equip young men in Birmingham, Alabama with leadership, job and youth mentoring through a woodworking program which is specifically designed to promote a positive employment experience for young men who desire to step up and lead in their community and city.",,,,,100.0,161.3384433962264,321.9555817610063,,685.5208333333334,774.2285770440252,1467.9068396226414,1016.2470518867925
465389687,THE AARRK GARDENS,"ASSISTING THE HOMELESS IN OBTAINING A JOB, A CAR, AND HOUSING AND TO EDUCATE SOCIETY ABOUT THE CHALLENGES OF HOMELESSNESS.",,,,,100.0,130.09736004493539,,,,,,
465399011,316 Ministries,"316 Ministries exists to help those in need. Primarily we deal with the homeless population in San Diego, California. 316 Ministries provides food for the homeless and necessities such as tents, sleeping bags, clothing, blankets, care packages and every day necessities. In addition, we visit convalescent homes and provide them with bibles, reading materials and spend quality time with these often forgotten seniors.",,,,,100.0,539.0507726269316,1.4009169638308712,122.7160808286636,169.10765834606894,110.37527593818986,,93.39446425539141
465437851,CHARLES PARK CONSERVATION SOC INC,"TO PROVIDE FUNDING TO BEAUTIFY CHARLES PARK, HOWARD BEACH NY",,,,,,,100.0,,,,,
465438200,THE MICHAEL P DEVITO MEMORIAL,FUNDRAISING FOR EDUCATIONAL SCHOLARSHIPS.,,,,,100.0,0.0,60.9271523178808,2810.5960264900664,4.317880794701987,55.62913907284768,253.50993377483442,
465442758,OPERATION SONG INC,OPERATION SONG'S MISSION IS TO EMPOWER VETERANS AND ACTIVE DUTY MILITARY TO TELL THEIR STORES THROUGH THE PROCESS OF SONGWRITING IN CREATIVE AND THERAPEUTIC SETTINGS.,,,,,100.0,116.54598473182398,186.67802496641656,290.4475606959143,370.12384915304216,411.5690835817961,338.54395334359947,684.5401526817601
465445364,DISCOVERY SKI EDUCATION FOUNDATION,"TO PROVIDE INSTRUCTION IN THE SPORT OF SKIING TO YOUTH AGES 6 TO 18 TO PROVIDE OPPORTUNITIES FOR PARTICIPANTS TO ENGAGE IN RECREATIONAL, COMPETITIVE AND SKIING TO HOST AND/OR PARTICIPATE IN EVENTS AND ACTIVITIES THAT PROMOTE THE SPORT OF SKIING AND SKI RACING",,,,,,100.0,,343.6016294423374,,179.6432083157747,231.27124596151143,321.31198201994664
465452232,MILES FOR MILES FOUNDATION,THE ORGANIZATION SUPPORTS LOCAL NON-PROFITS THAT ENHANCE THE LIVES OF PEOPLE WITH INTELLECTUAL AND DEVELOPMENTAL DISABILITIES.,,,,100.0,133.21622094039503,145.8713511623842,378.8061527704947,238.90753364796362,332.97325642370214,-25.86785527005768,84.93794791120433,398.8498514245761
465472077,Baptist Christian Camp of California,To promote Christian values and minister to youth.,,,,,100.0,119.63011829952815,152.55197501323136,218.3807798674628,166.87315040514048,165.2257530693025,190.05970883556589,214.50976884257292
465472077,BAPTIST CHRISTIAN CAMP OF CALIFORNIA,TO PROMOTE CHRISTIAN VALUES AND MINISTER TO YOUTH,,,,,100.0,119.63011829952815,152.55197501323136,218.3807798674628,166.87315040514048,165.2257530693025,190.05970883556589,214.50976884257292
465479917,RICHARD WURMBRAND FOUNDATION INC,"RELIGIOUS, EDUCATIONAL AND CHARITABLE SUPPORTS",,,,,100.0,655.9326920556706,798.812675281105,268.69708804025896,284.9028909915341,304.9170445312295,344.489293109323,498.0971352187246
465489340,CLEAN ENERGY EDUCATION LTD,"TO BRING ALL FORMS OF RENEWABLE ENERGY INTO THE MAINSTREAM OF AMERICA'S ECONOMY AND LIFESTYLE THROUGH INFORMATION AND EDUCATION. WE PROMOTE ALL RENEWABLE ENERGY OPTIONS FOR THE PRODUCTION OF ELECTRICITY, HYDROGEN, FUELS AND END-USE ENERGY.",,,,,,,100.0,,,,,
465493989,SHAWANO AREA MATTHEW 25 INC,"We help those affected by poverty improve their circumstances and become self-sufficient. We operate a homeless shelter for overnight occupancy from 11/1 to 4/30 each year. Our community works together to meet the needs of those living in poverty and offers a structured opportunity to gain self-sufficiency, and to have a hope for a better future.",,,,,100.0,74.35976307092886,161.42330959310348,,387.35773608120576,,343.1567407267192,379.05259920024605
465501157,NORTHERN NEW MEXICANS PROTECTING,"NORTHERN NEW MEXICANS PROTECTING LAND WATER AND RIGHTS STRIVES TO LESSEN THE STRESS OF NEIGHBORHOOD TENSIONS DUE TO LACK OF INFORMATION AND FAIR REPRESENTATION. BY PROVIDING AN ORGANIZATION WHOSE MAIN GOAL IS TO UNITE AND EMPOWER THE COMMUNITY AGAINST PREJUDICE AND DISCRIMINATION WITHIN COMMUNITY MEMBERS, COMMUNITY DETERIORATION CAN BE STOPPED AND REPAIRED. TO ACHIEVE THESE GOALS, THE MISSION IS ACCOMPLISHED THROUGH ADDRESSING ISSUES - THE ORGANIZATION , TO THE BEST OF ITS ABILITY, COORDINATES THE RESOURCES NEEDED TO ADDRESS COMMUNITY ISSUES THROUGH LEGAL, POLITICAL AND COMMUNITY OUTREACH PROGRAMS EDUCATING THE COMMUNITY MEMBERS - THE ORGANIZATION PROVIDES INFORMATION TO THE COMMUNITY MEMBERS TO EDUCATE THEM ON VARIOUS ISSUES RELATED TO LAND AND WATER RIGHTS. COORDINATE - THE ORGANIZATION COORDINATES MEMBERS TO PROVIDE A SIGNIFICANT VOICE TO BE HEARD ON VARIOUS ISSUES RELATED TO LAND AND WATER RIGHTS. THE ORGANIZATION FIGHTS TO PROTECT THE RIGHTS OF INDIVIDUAL PROPERTY OWNERS AND RESID",,,,,100.0,95.29013872796168,18.63589390285911,11.740206056430653,4.496915416653619,1.1680706479190806,1.644067265837848,
465510049,GIRLS EXPECTING MORE SUCCESS INC,IDENTIFYING AND PROVIDING MEANINGFUL EXPERIENCES AND MENTORING FOR GIRLS WHO ARE AT RISK.,,,,,100.0,137.2981799984197,63.39716069218005,,117.12539837227065,7.901598756815129,44.29899649695788,
465519311,Letterform Archive,"To inspire and educate designers, students and admirers of graphic design, letters, typography and calligraphy.",,,,,,100.0,71.99269110278203,81.55819696033345,102.34863867776379,130.0859571257735,216.7974616831331,201.87243673603697
465542678,ARUKAH HOUSE,"PURPOSE AND MISSION IS TO PROVIDE BENEVOLENT SERVICES TO THE GULF COAST POPULATION THAT PROMOTE HEALTHY LIFESTYLES, EMPOWER FAMILIES AND ENRICH COMMUNITIES.",,,,,,100.0,114.534143144603,179.81871550148608,154.670875716123,217.80169469622845,384.04991784969263,375.44413471419693
465580136,FARM TO FORK MEAT RIOT CORPORATION,THE PRIMARY PURPOSE OF THIS ORGANIZATION IS TO EDUCATE AND PROVIDE RESOURCES THAT PROMOTE STRATEGIES TO HELP INDIVIDUALS MAXIMIZE FOOD RESROUCES AND MAKE HEALTHY FOOD CHOICES THAT SUPPORT AND PROMOTE GOOD HEALTH,,,,,100.0,0.0,,,,,,
465628341,Aspire Movement Inc,See Sch O,,,,,100.0,135.57841923089137,153.07675208789811,166.4951891016481,184.5143056746372,196.97183322219047,193.34667047727922,316.4364421580769
465629799,SNAC,"SNAC IS A NON-PROFIT ORGANIZATION DEDICATED TO DECREASE THE NUMBER OF HOMELESS, INDIGENT, AND HUNGRY CHILDREN IN FLORENCE SCHOOL DISTRICT ONE BY PROVIDING AID TO FAMILIES FOR HOUSEHOLD BILLS OR HOTEL/RESTAURANT VOUCHERS IN EMERGENCY SITUATIONS.",,,,,100.0,96.81839561013848,66.32558139534885,44.182910896263394,33.030572249804024,,,80.89260517376535
465633984,CATSKILL ANIMAL RESCUE INC,"TO PROVIDE A RESCUE SHELTER FOR ANIMALS THAT HAVE BEEN ABANDONED, ABUSED, NEGLECTED OR ARE UNWANTED, AND TO PROVIDE FOR NEUTERING AND ADOPTIONS OF ANIMALS THAT HAVE BEEN PLACED IN THE RESCUE SHELTER.",,,,,100.0,,,,,228.1876637294594,415.75851393188856,495.9323648487735
465637704,GO PANTRY CORPORATION,"GO PANTRY STRIVES TO MAKE A POSITIVE IMPACT ON LOCAL KIDS BY PROVIDING FOOD TO THOSE WHO ARE HUNGRY. SPECIFICALLY, GO PANTRY HELPS HUNGRY SCHOOL-AGE CHILDREN IN BOONE COUNTY WHO DO NOT HAVE ENOUGH TO EAT ON DAYS THEY ARE AWAY FROM SCHOOL.",,,,,,,100.0,117.52524849012104,155.46056856078428,269.1978777360545,350.7153615571949,338.0320825232807
465638865,HEAVENLY GAITS THERAPEUTIC,"TO PROVIDE MEANINGFUL INSTRUCTIONS IN HORSEMANSHIP THAT ACCOMMODATE AND ENHANCE THE QUALITY OF LIFE OF THOSE CHALLENGED BY PHYSICAL, COGNITIVE, EMOTIONAL, AND/OR SOCIAL CONSTRAINTS.",,,,,100.0,73.40987670428599,81.55239524213364,81.54260986800618,51.80594515841433,33.20286167830039,82.06232196055407,84.07810903081305
465649514,Paving TheWay Multi Service Institute,"Behavioral Health Clinic commited to providing medical/ clinical management to children, adolescents, adults and famalies living in the District of Columbia so they may function to their full potential.",,,,,100.0,1735.6983527796842,2453.2258064516127,3136.83081674674,3747.9838709677415,4922.580645161291,,19595.52161976664
465649514,Paving the Way Multi Service Institute,"Behavioral Health Clinic commited to providing medical/ clinical management to children, adolescents, adults and famalies living in the District of Columbia so they may function to their full potential.",,,,,100.0,1735.6983527796842,2453.2258064516127,3136.83081674674,3747.9838709677415,4922.580645161291,,19595.52161976664
465654255,EAST NEW ORLEANS BUSINESS,"TO FOSTER, COORDINATE AND CATALYZE INITIATIVES THAT IMPROVE THE BUSINESS CLIMATE AND QUALITY OF LIFE IN EAST NEW ORLEANS THROUGH BUSINESS DEVELOPMENT, INFRASTRUCTURE IMPROVEMENT, AND IMAGE ENHACEMENT, IN ORDER TO GROW GOOD JOBS, INVESTMENTS AND TAX REVENUE IN THE CITY OF NEW ORLEANS.",,,,,,100.0,66.91018727894706,,58.271003652809185,,,
465673059,HERMISTON ROTARY CLUB FOUNDATION,CHARITABLE ACTIVITIES,,,,,100.0,256.13917770395614,36.12752922904353,36.10164372923767,36.03045860477156,59.58842055308684,46.684498899866256,
465681949,VUNDER KID INC,PROVIDE EDUCATIONAL SERVICES TO COMMUNITY/PUBLIC WITH FOCUS ON THE RUSSIAN LANGUAGE AND LITERATURE.,,,,,100.0,222.7733904784581,225.78144635369125,134.69582126274852,133.89949336613887,,,
465687279,WILLIE MAE RIVERS MINISTRIES,RELIGIOUS MINISTRY AND COMMUNITY SUPPORT,,,,100.0,,197.38611571116894,74.18447546197724,45.92224587966249,,39.357569066582556,21.320085166784956,33.80490497594827
465689396,Veterans Healing Farm,"Our mission is to serve our nation's veterans by growing and donating high-quality fruits, vegetables, and flower bouquets to veterans and their caregivers free of charge.",,,,,100.0,71.11502130024078,125.91473168431864,275.97198134334644,208.24900234050077,204.30719493508897,174.5222179191433,232.43614137298155
465696734,Aselsi USA,"To provide training, mentoring, financial support, and volunteer teams",,,,,,100.0,292.6173954415289,366.6193883138684,362.26199987432335,384.5767839349354,428.9980879197824,360.8885338025261
465709080,JESUS CHRIST NETWORK INC,THE ORGANIZATION SUPPORTS THE CATHOLIC CHURCH BY PRODUCING AND BROADCASTING RELIGIOUS PROGRAMMING VIA VARIOUS MEDIA PLATFORMS.,,,,,,100.0,132.25039922371045,131.66894612581086,34.54832326041611,55.708708043307176,,69.22195310171992
465736231,United Force Boosters,To support and enhance the advancement of cheering activities,,,,,100.0,,,,,,,
465748280,STONES THROW CHRISTIAN MINISTRY,"THE MISSION OF STONE'S THROW CHRISTIAN MINISTRY, INC. IS TO GLORIFY GOD BY PROVIDING OUR ASSISTANCE TO INDIVIDUALS, CHURCHES, MISSION TEAMS AND OTHER AGENCIES. WE GATHER AND STRIVE TO PROVIDE THE RESOURCES NEEDED TO ASSIST THOSE WHO ARE HURTING. OUR MINISTRY USES CRISES TO MEET THE SPIRITUAL NEEDS OF OTHERS. OUR MOST IMPORTANT GOAL IS TO SHARE THE LOVE OF JESUS. ALONG THE WAY, WE ARE HELPING TO SLAY THE GIANTS THAT ARISE IN LIFE.",,,,,100.0,191.51760939167556,480.46318036286016,456.0960512273212,313.3425827107791,367.54322305229454,496.8345784418356,611.3959445037353
470972336,MAP OF HOPE FOUNDATION,"ORGANIZED TO PROMOTE AWARENESS TO WORTH WHILE CHARITIES AND CAUSES, BY ORGANIZING EVENTS FOR THEIR BENEFIT.",,,,,100.0,26.439909297052154,168.11791383219955,66.30385487528345,104.85260770975056,403.58276643990934,211.0657596371882,190.68027210884352
470989142,MEN'S HEALTH FOUNDATION,"CONNECTS MEN AT RISK TO COMPREHENSIVE HEALTHCARE AND WELLNESS THROUGH EDUCATION, COLLABORATION, AND ADVOCACY. MHF'S VISION IS A WORLD WHERE INEQUITY AND STIGMA DO NOT SEPARATE MEN FROM HEALTHCARE.",,,,,100.0,1408.3954028269834,4194.987485339105,7159.487563933594,10257.657219206076,11999.15208638139,12587.38890971307,13279.883136041013
470989142,MENS HEALTH FOUNDATION,"CONNECTS MEN AT RISK TO COMPREHENSIVE HEALTHCARE AND WELLNESS THROUGH EDUCATION, PARTNERSHIPS AND COLLABORATION, INSPIRING AND EMPOWERING ALL MEN TO LIVE LONGER HEALTHIER AND HAPPIER LIVES.",,,,,100.0,1408.3954028269834,4194.987485339105,7159.487563933594,10257.657219206076,11999.15208638139,12587.38890971307,13279.883136041013
470995163,IDANCE ACADEMI,Teching dance clasess for at risk inner city children,,,,,100.0,0.0,0.0,,,,,
470996261,512 BROTHERS & SISTERS,"Brothers Sisters LLCS Primary Mission is to offer training, co-ordinate food and clothing drives, offer home remodelling, provide aid and charity to those are in need both locally and globally by partnering up with already established recognized charities doing humanitarian aid internationally.",,,,,100.0,969.7147037307973,858.327237259205,1003.0968056571569,612.8749085588881,1082.1506949524507,1037.9175810777858,3391.880029261156
470999974,BAYIT CHAM MORESHET CHANA INC,"TO HELP NEEDY, SICK, DISABLED MEMBERS OF THE ISRAELI-JEWISH COMMUNITY WITH THEIR FINANCIAL CRISIS",,,,,100.0,164.39433780348847,93.15014462266632,26.023314926812162,,0.0,,
471038347,Wyoming Housing Partnership Inc,"The mission of the Wyoming Housing Partnership, Inc. (WHP) is to create and maintain affordable housing and to support successful homeownership for Wyoming's workforce",,,,,,,100.0,378.7962962962963,426.7189366786141,421.42622461170845,423.4154719235365,546.0663082437276
471038412,Playzeum Yuba-Sutter,"THE ORGANIZATION PROVIDES A VARIETY OF PROGRAMS TO INCREASE CHILD AND PARENT/CAREGIVER COMMUNITY-BASED EARLY LEARNING PROGRAMS FOR CHILDREN 0 TO 5 AND THEIR FAMILIES. THE THREE PROGRAMS ARE FAMILIES LEARNING IN PLAY (FLIP), HELP ME GROW PLAYGROUPS AND SUMMER CAMP.",,,,,,100.0,27.057258916697137,142.42728627851193,,147.76263927003018,,133.8334264143969
471038949,Ransomed Life Inc,Is dedicated to the process of restoring,,,,,100.0,,265.4737003214122,857.8592928932197,1446.4670169889291,1195.1839191877966,1357.7394010509668,1399.3138105198714
471040362,BUT YOU DONT LOOK SICK FOUNDATION,"TO PROVIDE SCHOLARSHIPS,CAMPERSHIPS, OR GRANTS TO LUPIS PATIENTS OR THEIR CHILDREN.",,,,,100.0,0.0,,,,,,
471052067,RAY OF HOPE FOSTER CARE INC,"STRENGTHENING CHILDREN AND THEIR FAMILIES BY PARTNERING WITH FOSTER PARENTS AND THE COMMUNITY TO PROMOTE STABILITY STRENGTHEN CONNECTIONS, AND ENCOURAGE LIFELONG BONDS",,,,,,100.0,100.0,100.0,100.0,100.0,,41.87587126928789
471067268,CASCADE VIEW CHRISTIAN SCHOOL,"THE PRIMARY PURPOSE OF THE ORGANIZATION IS TO OPERATE A CHRISTIAN SCHOOL THAT PROVIDES A DISTINCTIVE CHRISTIAN EDUCATIONAL ENVIRONMENT THAT GRADUATES STUDENTS WHO DEMONSTRATE GODLY CHARACTER, AND WHO ARE PREPARED TO BE PROFICIENT IN ACADEMICS AND LIFE SKILLS.",,,,,,,100.0,135.58883819857587,,129.80102339631947,219.52506087975095,292.60927529977494
471067342,ABANDONED PET PROJECT,TREATING SHELTER ANIMALS THAT ARE AT RISK OF BEING EUTHANIZED DUE TO MEDICAL,,,,100.0,636.4991767790718,1169.4188670040855,1471.1232392219038,1237.4717970607965,1170.4097810842125,912.0617110799438,758.3602658698701,830.0048783462406
471067342,VET RANCH INC,TREATING SHELTER ANIMALS THAT ARE AT,,,,100.0,636.4991767790718,1169.4188670040855,1471.1232392219038,1237.4717970607965,1170.4097810842125,912.0617110799438,758.3602658698701,830.0048783462406
471075307,THE LEO & ANNE ALBERT INSTITUTE FOR BLADDER CANCER CARE AND RESEARCH,"foster medical and scientific research and education in the care and treatment of patients with bladder cancer through collaborative research with academia, private foundations, the federal/local government and industry.",,,,100.0,117.16335302827734,61.81624761001135,185.26904443581893,185.0907836287575,186.2890125213841,109.43344690271847,72.96832995500353,221.09299751297425
471079587,MINISTERIO MISIONERO EVANGELISTICO CHAPLAINS NJ,TEACHING CHRISTIAN DOCTRINE,,,,,,100.0,,,,,,
